{
  "format": "vibedock-2d",
  "version": 1,
  "preset": "modern",
  "palette": {
    "background": "#72b3ed",
    "title": "#ffffff",
    "text": "#172b47",
    "muted": "#465d73",
    "track": "#c7d2b3",
    "warning": "#aa2330"
  },
  "font": "DejaVu Sans",
  "layers": {
    "background": [
      {
        "op": "gradient",
        "x": 0,
        "y": 0,
        "width": {
          "relative": 1,
          "pixels": 0
        },
        "height": {
          "relative": 1,
          "pixels": 0
        },
        "color": "#4b99e4",
        "to": "#b5dcf4"
      },
      {
        "op": "ellipse",
        "x": {
          "relative": -0.15,
          "pixels": 0
        },
        "y": {
          "relative": 0.83,
          "pixels": 0
        },
        "width": {
          "relative": 1.3,
          "pixels": 0
        },
        "height": {
          "relative": 0.4,
          "pixels": 0
        },
        "color": "#80b83a"
      },
      {
        "op": "ellipse",
        "x": {
          "relative": 0.45,
          "pixels": 0
        },
        "y": {
          "relative": 0.87,
          "pixels": 0
        },
        "width": {
          "relative": 0.9,
          "pixels": 0
        },
        "height": {
          "relative": 0.3,
          "pixels": 0
        },
        "color": "#55942c"
      }
    ],
    "band": [
      {
        "op": "rect",
        "x": 2,
        "y": 2,
        "width": {
          "relative": 1,
          "pixels": -4
        },
        "height": {
          "relative": 1,
          "pixels": -3
        },
        "color": "#0954da",
        "radius": 7
      },
      {
        "op": "rect",
        "x": 4,
        "y": 4,
        "width": {
          "relative": 1,
          "pixels": -8
        },
        "height": {
          "relative": 1,
          "pixels": -5
        },
        "color": "#ece9d8",
        "radius": 5
      },
      {
        "op": "gradient",
        "x": 4,
        "y": 4,
        "width": {
          "relative": 1,
          "pixels": -8
        },
        "height": 24,
        "color": "#5ba0ff",
        "to": "#0861e5"
      },
      {
        "op": "gradient",
        "x": 4,
        "y": 13,
        "width": {
          "relative": 1,
          "pixels": -8
        },
        "height": 15,
        "color": "#1377f0",
        "to": "#0444be"
      },
      {
        "op": "line",
        "x": 8,
        "y": 5,
        "width": {
          "relative": 1,
          "pixels": -16
        },
        "height": 0,
        "color": "#b0d0ff",
        "opacity": 0.85
      },
      {
        "op": "line",
        "x": 4,
        "y": 28,
        "width": {
          "relative": 1,
          "pixels": -8
        },
        "height": 0,
        "color": "#0a48c0"
      },
      {
        "op": "line",
        "x": 5,
        "y": 29,
        "width": {
          "relative": 1,
          "pixels": -10
        },
        "height": 0,
        "color": "#fffdf1"
      },
      {
        "op": "rect",
        "x": 2,
        "y": 2,
        "width": {
          "relative": 1,
          "pixels": -5
        },
        "height": {
          "relative": 1,
          "pixels": -4
        },
        "color": "#003ead",
        "fill": false,
        "radius": 7
      },
      {
        "op": "line",
        "x": 5,
        "y": {
          "relative": 1,
          "pixels": -2
        },
        "width": {
          "relative": 1,
          "pixels": -10
        },
        "height": 0,
        "color": "#002c91"
      }
    ]
  },
  "barColor": "#48a52b"
}
