{
  "format": "vibedock-2d",
  "version": 2,
  "preset": "fluent",
  "palette": {
    "background": "#1f5fbf",
    "title": "#1a1a1a",
    "text": "#1a1a1a",
    "muted": "#5f5f5f",
    "track": "#d4d4d4",
    "warning": "#c42b1c"
  },
  "font": "DejaVu Sans",
  "window": {
    "surface": "#f3f3f3",
    "titleBar": "#f3f3f3",
    "titleText": "@title",
    "border": "#d0d0d0",
    "highlight": "#ffffff",
    "edgeLight": "#dfdfdf",
    "edgeDark": "#808080",
    "controls": "#5c5c5c",
    "shadow": "#000000",
    "shadowAlpha": 60,
    "radius": 6
  }
}
